job_title,company_name,address,job_description,job_source_url,job_posted_date,job_source,job_type
Developer,Randstad Technologies,"Remote or Dallas, TX, USA","job summary: Job Duties: The candidate is required to use Java, Azure SQL, Kafka, Cassandra, Splunk, Dyna Trace as part of their development with unit testing. Additional Job Details Java Kafka Azure SQL Cassandra Remote - Preferably in these three locations, BV, Dallas, Sunnyvale location: Dallas, Texas job type: Contract salary: $51 - 75 per hour work hours: 8am to 4pm education: Bachelors responsibilities: Work in a small, high performance agile team environment sharing innovati",https://www.dice.com/job-detail/41071794-fe86-4f1c-a88e-8458bde30b05?searchlink=search%2F%3Fq%3Ddeveloper%26location%3DUnited%2520States%26latitude%3D37.09024%26longitude%3D-95.712891%26countryCode%3DUS%26locationPrecision%3DCountry%26radius%3D30%26radiusUnit%3Dmi%26page%3D1%26pageSize%3D100%26filters.postedDate%3DONE%26filters.employmentType%3DCONTRACTS%26language%3Den%26eid%3DS2Q_&searchId=57de37fe-6ab8-4fe2-a138-eaa68f3150d1,Posted 12 hours ago,Dice,contract
Front End Developer,Robert Half,"Austin, TX, USA","Description We are seeking a talented and experience Front-End Developer/Designer with Figma, Adobe Animate, art direction, graphic design, and quality assurance skills to join our team. The ideal candidate should have a passion for creating beautiful and functional web designs, and be able to translate those designs into clean and efficient code. In this role, you will be responsible for developing and maintaining front-end web applications that meet the needs of our clients and users. Key Res",https://www.dice.com/job-detail/ce0b138d-bee7-4203-9860-96aecc833681?searchlink=search%2F%3Fq%3Ddeveloper%26location%3DUnited%2520States%26latitude%3D37.09024%26longitude%3D-95.712891%26countryCode%3DUS%26locationPrecision%3DCountry%26radius%3D30%26radiusUnit%3Dmi%26page%3D1%26pageSize%3D100%26filters.postedDate%3DONE%26filters.employmentType%3DCONTRACTS%26language%3Den%26eid%3DS2Q_&searchId=57de37fe-6ab8-4fe2-a138-eaa68f3150d1,Posted 6 hours ago,Dice,contract
Database Developer,Robert Half,"Houston, TX, USA","Description Do you possess a strong set of skills in relational databases? Are you excited about designing, building and developing database architecture? If you're looking for work as a Database Developer, Robert Half is looking for candidates with a strong command of query writing and an interest in developing systems to join the efforts of a growing company in the Energy/Natural Resources industry. This Database Developer position will be a long-term contract / temporary opportunity based",https://www.dice.com/job-detail/84a79336-be02-4bab-9cbc-caa005b5c024?searchlink=search%2F%3Fq%3Ddeveloper%26location%3DUnited%2520States%26latitude%3D37.09024%26longitude%3D-95.712891%26countryCode%3DUS%26locationPrecision%3DCountry%26radius%3D30%26radiusUnit%3Dmi%26page%3D1%26pageSize%3D100%26filters.postedDate%3DONE%26filters.employmentType%3DCONTRACTS%26language%3Den%26eid%3DS2Q_&searchId=57de37fe-6ab8-4fe2-a138-eaa68f3150d1,Posted 6 hours ago,Dice,contract
Web Developer,Randstad Technologies,"Redmond, WA, USA","job summary: Join us in the Gaming Ecosystem Organization (GEO) and be part of our mission to empower game creators to realize their dreams by delivering the world's best tools and services. We are looking for people who are energized by innovating the tools that support every stage in a game's life cycle. As game creators evolve to deliver their titles as Games-as-a-Service, we are supercharging our developer tools to support accelerated production environments, agile back-end infrastructure,",https://www.dice.com/job-detail/2526947f-b339-4a57-9038-613ba0a6754c?searchlink=search%2F%3Fq%3Ddeveloper%26location%3DUnited%2520States%26latitude%3D37.09024%26longitude%3D-95.712891%26countryCode%3DUS%26locationPrecision%3DCountry%26radius%3D30%26radiusUnit%3Dmi%26page%3D1%26pageSize%3D100%26filters.postedDate%3DONE%26filters.employmentType%3DCONTRACTS%26language%3Den%26eid%3DS2Q_&searchId=57de37fe-6ab8-4fe2-a138-eaa68f3150d1,Posted 15 hours ago,Dice,contract
Developer III,Randstad Technologies,"Chicago, IL, USA","job summary: - DEVOPS position with extensive Harness experience - Bachelor's degree or higher in Computer Science, Computer Engineering, Electrical Engineering, Management Information Systems and/or equivalent work experience - 6+ years of experience in design, development, documenting, testing, and debugging of new and existing software systems and/or applications for market sale or large-scale proprietary software for internal use - 3+ years of development experience in AWS cloud platform",https://www.dice.com/job-detail/cdad74aa-0094-4dd5-8028-9d2068dd0aaf?searchlink=search%2F%3Fq%3Ddeveloper%26location%3DUnited%2520States%26latitude%3D37.09024%26longitude%3D-95.712891%26countryCode%3DUS%26locationPrecision%3DCountry%26radius%3D30%26radiusUnit%3Dmi%26page%3D1%26pageSize%3D100%26filters.postedDate%3DONE%26filters.employmentType%3DCONTRACTS%26language%3Den%26eid%3DS2Q_&searchId=57de37fe-6ab8-4fe2-a138-eaa68f3150d1,Posted 12 hours ago,Dice,contract
Web Developer,Randstad Technologies,"Charlotte, NC, USA","job summary: Description: Develops, enhances, tests, supports, maintains and debugs software applications that support business units. A senior member of the technical team responsible for assisting senior business leaders and management. Spring, Spring MVC, Spring Batch or Quartz on JBoss. Or Spring Boot Eclipse or IntelliJ IDE, Maven, JUnit Multiple system integration protocol exposure: especially SOAP or RESTful web services, file exchange, MQ/JMS messaging Hibernate & SQL for complex querie",https://www.dice.com/job-detail/980d3770-426b-4fb1-a03b-2a3c3930d938?searchlink=search%2F%3Fq%3Ddeveloper%26location%3DUnited%2520States%26latitude%3D37.09024%26longitude%3D-95.712891%26countryCode%3DUS%26locationPrecision%3DCountry%26radius%3D30%26radiusUnit%3Dmi%26page%3D1%26pageSize%3D100%26filters.postedDate%3DONE%26filters.employmentType%3DCONTRACTS%26language%3Den%26eid%3DS2Q_&searchId=57de37fe-6ab8-4fe2-a138-eaa68f3150d1,Posted 9 hours ago,Dice,contract
Web Developer,Randstad Technologies,"Pennington, NJ, USA","job summary: Description: 10 + years. Develops, enhances, tests, supports, maintains and debugs software applications that support business units or support functions. A senior member of the technical team responsible for assisting senior business leaders and management. May provide strategic technical direction and system architecture for individual initiatives. Utilizes in-depth knowledge of technological alternatives and business system requirements to recommend innovations that enhance and/",https://www.dice.com/job-detail/edf2b7e5-b5cf-458c-904a-8ef675cae357?searchlink=search%2F%3Fq%3Ddeveloper%26location%3DUnited%2520States%26latitude%3D37.09024%26longitude%3D-95.712891%26countryCode%3DUS%26locationPrecision%3DCountry%26radius%3D30%26radiusUnit%3Dmi%26page%3D1%26pageSize%3D100%26filters.postedDate%3DONE%26filters.employmentType%3DCONTRACTS%26language%3Den%26eid%3DS2Q_&searchId=57de37fe-6ab8-4fe2-a138-eaa68f3150d1,Posted 15 hours ago,Dice,contract
Software Developer,Kforce Technology Staffing,"Daytona Beach, FL, USA","RESPONSIBILITIES: Kforce has a client in Daytona Beach, FL looking for a Software Developer. Summary: The Software Developer will be responsible for supporting our software development team in all aspects of the development, testing and implementation of our business. This individual will be self-motivated and enthusiastic about solving complex problems, testing innovative approaches, and researching new solutions. Essential Duties and Responsibilities: * Software Developer will be writing and",https://www.dice.com/job-detail/617b3d3c-2a52-4bcb-b66c-5387993c8585?searchlink=search%2F%3Fq%3Ddeveloper%26location%3DUnited%2520States%26latitude%3D37.09024%26longitude%3D-95.712891%26countryCode%3DUS%26locationPrecision%3DCountry%26radius%3D30%26radiusUnit%3Dmi%26page%3D1%26pageSize%3D100%26filters.postedDate%3DONE%26filters.employmentType%3DCONTRACTS%26language%3Den%26eid%3DS2Q_&searchId=57de37fe-6ab8-4fe2-a138-eaa68f3150d1,Posted 11 hours ago,Dice,contract
"Contact Center Engineer / IVR Engineer / IVR Developer- Fort Worth, TX",Amaze Systems Inc,"Fort Worth, TX, USA","Title- IVR developer Work site: Fort Worth, TX, USA Remote- NO Note: Interactive voice response (IVR) is telephony software technology commonly found in Contact Centers. Here's the JD for such a role 3+ Years of experience as IVR developer Proficient in Java and VXML Experience in Nuance products such as Nuance Speech Suite Experience in Genesys Composer call flow development and deployment Experience in RDBMS concepts Good troubleshooting skills (Log reading, tracing calls and analyzing i",https://www.dice.com/job-detail/d7b2d23a-ae9a-47ad-ab4f-88970b7c42cb?searchlink=search%2F%3Fq%3Ddeveloper%26location%3DUnited%2520States%26latitude%3D37.09024%26longitude%3D-95.712891%26countryCode%3DUS%26locationPrecision%3DCountry%26radius%3D30%26radiusUnit%3Dmi%26page%3D1%26pageSize%3D100%26filters.postedDate%3DONE%26filters.employmentType%3DCONTRACTS%26language%3Den%26eid%3DS2Q_&searchId=57de37fe-6ab8-4fe2-a138-eaa68f3150d1,Posted 14 hours ago,Dice,contract
Mulesoft Developer,Randstad Technologies,"Plano, TX, USA","job summary: Position Summary: Mulesoft (with Salesforce experience desirable). Primary Skill: Mule ESB Secondary Skill: Salesforce Required Skills: MuleSoft/ Salesforce developer needed for a target state commercial credit underwriting, fulfillment and monitoring system. The developer should be well versed integrations and web services. The solution runs on Force.com with 30+ integration points. The code and design savvy lead developer is an expert in MuleSoft ESB, Java, Java Spring, Salesforc",https://www.dice.com/job-detail/964ed4b4-511b-46c7-a3aa-ea53634291ee?searchlink=search%2F%3Fq%3Ddeveloper%26location%3DUnited%2520States%26latitude%3D37.09024%26longitude%3D-95.712891%26countryCode%3DUS%26locationPrecision%3DCountry%26radius%3D30%26radiusUnit%3Dmi%26page%3D1%26pageSize%3D100%26filters.postedDate%3DONE%26filters.employmentType%3DCONTRACTS%26language%3Den%26eid%3DS2Q_&searchId=57de37fe-6ab8-4fe2-a138-eaa68f3150d1,Posted 6 hours ago,Dice,contract
SQL Developer - Pilot,Experis,"Charlotte, NC, USA","SQL Developer Our client in Charlotte, NC is looking for hardworking, motivated talent to join their team. Don't wait apply today! What's in it for you? Hybrid working model Contract Full time Job Description 7+ years of MS SQL server experience 5+ years of ETL (Extract, Transform, Load) Programming experience 7+ years of SDLC (System Development Life Cycle) experience 5+ years of SQL experience 4+ years of business intelligence experience 4+ years of experience with data analytics reportin",https://www.dice.com/job-detail/2b000bff-23f1-47db-a51e-f44036dafd15?searchlink=search%2F%3Fq%3Ddeveloper%26location%3DUnited%2520States%26latitude%3D37.09024%26longitude%3D-95.712891%26countryCode%3DUS%26locationPrecision%3DCountry%26radius%3D30%26radiusUnit%3Dmi%26page%3D1%26pageSize%3D100%26filters.postedDate%3DONE%26filters.employmentType%3DCONTRACTS%26language%3Den%26eid%3DS2Q_&searchId=57de37fe-6ab8-4fe2-a138-eaa68f3150d1,Posted 18 hours ago,Dice,contract
Junior .NET Developer - Remote,Centraprise Corp,"San Francisco, CA, USA","Position: Junior .NET Developer Location: SFO, CA (Remote) Hiring Type: Contract Job Description Exp: 2-3 years Managing L2 and L3 Level support team for.net based applications. Strong RDBMS concepts and experience in creating, maintaining and tuning Views, Stored Procedures. Leading and providing high-end application support on systems, managing incidents Ensuring that the goals of the Incident Management process are achieved restoring normal service within defined SLA Requires Skills :-- .",https://www.dice.com/job-detail/78218fa2-9d14-42b1-ac3e-762d41010c5d?searchlink=search%2F%3Fq%3Ddeveloper%26location%3DUnited%2520States%26latitude%3D37.09024%26longitude%3D-95.712891%26countryCode%3DUS%26locationPrecision%3DCountry%26radius%3D30%26radiusUnit%3Dmi%26page%3D1%26pageSize%3D100%26filters.postedDate%3DONE%26filters.employmentType%3DCONTRACTS%26language%3Den%26eid%3DS2Q_&searchId=57de37fe-6ab8-4fe2-a138-eaa68f3150d1,Posted 11 hours ago,Dice,contract
MuleSoft Developer,Kforce Technology Staffing,"Remote or Louisville, KY, USA","RESPONSIBILITIES: Kforce has a client that is seeking a MuleSoft Developer in Louisville, KY. Summary: The MuleSoft Developer codes software applications based on business requirements. The candidates work assignments are varied and frequently require interpretation and independent determination of the appropriate courses of action. Key Tasks: * MuleSoft Developer standardizes the quality assurance procedure for software * Oversees testing and debugging and develops fixes * Research complaints",https://www.dice.com/job-detail/028c8630-e343-485d-9bef-eb6f5f82d609?searchlink=search%2F%3Fq%3Ddeveloper%26location%3DUnited%2520States%26latitude%3D37.09024%26longitude%3D-95.712891%26countryCode%3DUS%26locationPrecision%3DCountry%26radius%3D30%26radiusUnit%3Dmi%26page%3D1%26pageSize%3D100%26filters.postedDate%3DONE%26filters.employmentType%3DCONTRACTS%26language%3Den%26eid%3DS2Q_&searchId=57de37fe-6ab8-4fe2-a138-eaa68f3150d1,Posted 8 hours ago,Dice,contract
Remote Job for Sr. Omnichannel Developer/ Tech Lead,KPG 99 Inc.,"Remote or Miami, FL, USA","Role : Sr. Omnichannel Developer/ Tech Lead Location : Remote must work EST hours Interview : Phone and Skype Duration : 6 months + Client is looking for a Omnichannel Sr. Developer/Tech Lead. They are looking for a Sr. developer/Tech Lead. Below is the technical skill breakdown (rough estimate): Omnichannel Chatbot (LivePerson preferred) 40% Integration with APIs, website, tagging frameworks and backend datastore 30% Intelligent Search and Search SaaS Integration (LucidWorks preferred) 30%",https://www.dice.com/job-detail/94c15d00-04b7-4158-8287-428a9a13be6d?searchlink=search%2F%3Fq%3Ddeveloper%26location%3DUnited%2520States%26latitude%3D37.09024%26longitude%3D-95.712891%26countryCode%3DUS%26locationPrecision%3DCountry%26radius%3D30%26radiusUnit%3Dmi%26page%3D1%26pageSize%3D100%26filters.postedDate%3DONE%26filters.employmentType%3DCONTRACTS%26language%3Den%26eid%3DS2Q_&searchId=57de37fe-6ab8-4fe2-a138-eaa68f3150d1,Posted 14 hours ago,Dice,contract
Sr. Python Developer,Centraprise Corp,"New York, NY, USA","Job Title: Sr. Python Developer Location: Charlotte, NC / Jersey City, NJ (Hybrid) Hire Type: Contract Job Description: Expertise in Core Python programming Strong knowledge in Capital Market domain (Risk, financial pricing, valuations etc.) Working knowledge and experience using threading limitation of Python and multi-process architecture. Familiarity with event driven programming in Python. Experience in scheduling jobs or trigger events programmatically. Hands on experience with JIRA, Agil",https://www.dice.com/job-detail/24f5ff5c-b185-4101-9d0a-d85a90958067?searchlink=search%2F%3Fq%3Ddeveloper%26location%3DUnited%2520States%26latitude%3D37.09024%26longitude%3D-95.712891%26countryCode%3DUS%26locationPrecision%3DCountry%26radius%3D30%26radiusUnit%3Dmi%26page%3D1%26pageSize%3D100%26filters.postedDate%3DONE%26filters.employmentType%3DCONTRACTS%26language%3Den%26eid%3DS2Q_&searchId=57de37fe-6ab8-4fe2-a138-eaa68f3150d1,Posted 11 hours ago,Dice,contract
UI Developer,Randstad Technologies,"Jersey City, NJ, USA","job summary: Role Overview: Seeking Developer with hands on experience on Angular or related UI frameworks, with 7 plus years of overall experience in UI development Primary Responsibilities: Developer with hands on experience on Angular or related UI frameworks, with 7 plus years of overall experience in UI development Should have hands on experience of Web Application development using advanced HTML designing and Java scripting. Excellent communication and analytical skills Knowledge of bank",https://www.dice.com/job-detail/2c82dcfa-efce-46de-b68f-664693ef5fa1?searchlink=search%2F%3Fq%3Ddeveloper%26location%3DUnited%2520States%26latitude%3D37.09024%26longitude%3D-95.712891%26countryCode%3DUS%26locationPrecision%3DCountry%26radius%3D30%26radiusUnit%3Dmi%26page%3D1%26pageSize%3D100%26filters.postedDate%3DONE%26filters.employmentType%3DCONTRACTS%26language%3Den%26eid%3DS2Q_&searchId=57de37fe-6ab8-4fe2-a138-eaa68f3150d1,Posted 9 hours ago,Dice,contract
React Developer (CLT),Matlen Silver,"Charlotte, NC, USA","Job Title: React Developer Duration: 12-18 months Location: Charlotte, NC Required Pay Scale: 60-70/hr. Job Summary: 5+ years dev experience with ReactThe successful candidate will have recent experience with React functional components, creating custom react hooks, creating/implementing design systems, and solving complex business problems using UI technologies Enterprise Independent Testing OMNIA project, funding supporting delivering extra components Must Haves / Required 5+ years React dev",https://www.dice.com/job-detail/c9052f6f-1f58-4ed6-971a-2fce112cd98b?searchlink=search%2F%3Fq%3Ddeveloper%26location%3DUnited%2520States%26latitude%3D37.09024%26longitude%3D-95.712891%26countryCode%3DUS%26locationPrecision%3DCountry%26radius%3D30%26radiusUnit%3Dmi%26page%3D1%26pageSize%3D100%26filters.postedDate%3DONE%26filters.employmentType%3DCONTRACTS%26language%3Den%26eid%3DS2Q_&searchId=57de37fe-6ab8-4fe2-a138-eaa68f3150d1,Posted 8 hours ago,Dice,contract
Axiom Developer,VeridianTech,"Remote or New York, NY, USA","Find the JD for your reference. Axiom Developer Location: 100% Remote Duration: Long Term Contract Interview: Phone and Skype Minimum of 2-3 years of Axiom ""SL controller view"" development experience is a must. Must have a development background with Axiom. Not looking for a BA or a Data Analyst. Need a coder with Axiom. Not a functional person but a technical. Person will play a crucial role in two projects. Needs to have 6-8 years of IT dev experience. Prior experience and knowledge on US",https://www.dice.com/job-detail/c6c88c40-5e13-45ef-aaa6-fe33458fc0ca?searchlink=search%2F%3Fq%3Ddeveloper%26location%3DUnited%2520States%26latitude%3D37.09024%26longitude%3D-95.712891%26countryCode%3DUS%26locationPrecision%3DCountry%26radius%3D30%26radiusUnit%3Dmi%26page%3D1%26pageSize%3D100%26filters.postedDate%3DONE%26filters.employmentType%3DCONTRACTS%26language%3Den%26eid%3DS2Q_&searchId=57de37fe-6ab8-4fe2-a138-eaa68f3150d1,Posted 14 hours ago,Dice,contract
AS400 Developer (onsite),United IT Solutions,"Issaquah, WA, USA","Release Comments: AS400, ISeries Onsite Day 1 Issaquah, CA Description: Client is looking for a talented and creative iSeries/AS400 Developer for Application Development and Solutions support. The developer will be working with one of the leading Wholesale retailers in the US. The ideal candidate should have the ability to work creatively and analytically in a problem-solving environment. The ideal candidate must possess excellent written and verbal communication skills with the ability and kn",https://www.dice.com/job-detail/5086a52a-021e-45f7-9146-ec814503de6c?searchlink=search%2F%3Fq%3Ddeveloper%26location%3DUnited%2520States%26latitude%3D37.09024%26longitude%3D-95.712891%26countryCode%3DUS%26locationPrecision%3DCountry%26radius%3D30%26radiusUnit%3Dmi%26page%3D1%26pageSize%3D100%26filters.postedDate%3DONE%26filters.employmentType%3DCONTRACTS%26language%3Den%26eid%3DS2Q_&searchId=57de37fe-6ab8-4fe2-a138-eaa68f3150d1,Posted 13 hours ago,Dice,contract
iOS Developer,The Ascent Services Group,"Aurora, CO, USA","Innova Solutions is immediately hiring for an iOS Developer position. Title: iOS Developer Position Type: Contract to Hire Location: Greenwood Village, CO (Hybrid Onsite) Job Description: This person is responsible for developing the iOS video streaming applications. Writing software, debugging, and ensuring that the project current and using best practices. Responsibilities: Write software, debug issues and ensure that the project is using best practices. Oversee the coding standards of t",https://www.dice.com/job-detail/8747653a-fbd3-411c-9df8-4c20df5c267c?searchlink=search%2F%3Fq%3Ddeveloper%26location%3DUnited%2520States%26latitude%3D37.09024%26longitude%3D-95.712891%26countryCode%3DUS%26locationPrecision%3DCountry%26radius%3D30%26radiusUnit%3Dmi%26page%3D1%26pageSize%3D100%26filters.postedDate%3DONE%26filters.employmentType%3DCONTRACTS%26language%3Den%26eid%3DS2Q_&searchId=57de37fe-6ab8-4fe2-a138-eaa68f3150d1,Posted 18 hours ago,Dice,contract
SAP Developer/Global Support Manager,DP Professionals Inc,"Remote or Columbia, SC, USA","DPP is seeking an SAP Developer and Global Support Manager for an opportunity in Columbia, SC. Project background: The following modules of SAP have been implemented across the enterprise: BI, MM, HR, Payroll, SRM, CRM, Treasury Management, and PBF. The implementation of SAP began in November 2007 with the FF and MM modules, and concluded in June 2013 with the implementation of PBF. The Treasurer s Office is planning to retire the existing Legacy systems, in addition to continuing to optimize th",https://www.dice.com/job-detail/9f367c3f-8f2f-4d92-b651-512a958b7c47?searchlink=search%2F%3Fq%3Ddeveloper%26location%3DUnited%2520States%26latitude%3D37.09024%26longitude%3D-95.712891%26countryCode%3DUS%26locationPrecision%3DCountry%26radius%3D30%26radiusUnit%3Dmi%26page%3D1%26pageSize%3D100%26filters.postedDate%3DONE%26filters.employmentType%3DCONTRACTS%26language%3Den%26eid%3DS2Q_&searchId=57de37fe-6ab8-4fe2-a138-eaa68f3150d1,Posted 15 hours ago,Dice,contract
Full Stack Developer,Randstad Technologies,"Addison, TX, USA","job summary: Position Summary: The successful candidate will be based in Charlotte, NC or Dallas, TX and will demonstrate superior .NET & SQL Server technical skills, a 'can do' attitude and possesses a 'continuous improvement' mentality. Excellent communication skills. Teamwork and a desire to lead a team and develop team members are essential. Required Skills: Full stack developer Object Orientated design/coding SQL skills - stored procedures, views, data modelling ASP.NET, C#, MVC, HTML/CS",https://www.dice.com/job-detail/3b57da93-2a60-4cc3-9755-0bbc259133b1?searchlink=search%2F%3Fq%3Ddeveloper%26location%3DUnited%2520States%26latitude%3D37.09024%26longitude%3D-95.712891%26countryCode%3DUS%26locationPrecision%3DCountry%26radius%3D30%26radiusUnit%3Dmi%26page%3D1%26pageSize%3D100%26filters.postedDate%3DONE%26filters.employmentType%3DCONTRACTS%26language%3Den%26eid%3DS2Q_&searchId=57de37fe-6ab8-4fe2-a138-eaa68f3150d1,Posted 12 hours ago,Dice,contract
UI Developer,Randstad Technologies,"Charlotte, NC, USA","job summary: Description: Primarily Angular UI developer with Java background in Containers and Micro services. Will be a part of a team working on application projects and break/fix items. Java, Core Java, J2EE, SpringMVC, SpringBoot, Hibernate, SQL, PL/SQL, Microservices Previous Experience in Banking and Finance Experience working in Agile teams -Experience with JavaScript frameworks and libraries, especially Angular -Understanding of enterprise change control systems and processes Educat",https://www.dice.com/job-detail/25c283b9-462f-426a-ac22-56fbc82ba235?searchlink=search%2F%3Fq%3Ddeveloper%26location%3DUnited%2520States%26latitude%3D37.09024%26longitude%3D-95.712891%26countryCode%3DUS%26locationPrecision%3DCountry%26radius%3D30%26radiusUnit%3Dmi%26page%3D1%26pageSize%3D100%26filters.postedDate%3DONE%26filters.employmentType%3DCONTRACTS%26language%3Den%26eid%3DS2Q_&searchId=57de37fe-6ab8-4fe2-a138-eaa68f3150d1,Posted 6 hours ago,Dice,contract
UI Developer,Randstad Technologies,"Charlotte, NC, USA","job summary: Position Summary: UI Application Developer: Develops, enhances, debugs, supports, maintains and tests software applications (primarily React JS,) that support business units or supporting functions operations. These application program solutions may involve diverse development platforms, software, hardware, technologies and tools. Participates in the design, development and implementation of complex applications, often using new technologies. May collaborate with external programm",https://www.dice.com/job-detail/26f4233e-006f-423e-9352-84ba31003dd5?searchlink=search%2F%3Fq%3Ddeveloper%26location%3DUnited%2520States%26latitude%3D37.09024%26longitude%3D-95.712891%26countryCode%3DUS%26locationPrecision%3DCountry%26radius%3D30%26radiusUnit%3Dmi%26page%3D1%26pageSize%3D100%26filters.postedDate%3DONE%26filters.employmentType%3DCONTRACTS%26language%3Den%26eid%3DS2Q_&searchId=57de37fe-6ab8-4fe2-a138-eaa68f3150d1,Posted 18 hours ago,Dice,contract
C# Machine Developer,Beacon Hill Technologies,"Ankeny, IA, USA","Position: C# Machine Developer Location: Onsite in Ankeny, IA Manager Notes: * C# Machine Automation Development, support of the lab automation process * Work in R&D, create things that have never been done before * Create C# applications to interact with automated machinery * Must have work experience with C# and databases * write software that interacts with automation machines * Responsible for code development, debugging, analyzing test results, implementation, support, and enhancement of a",https://www.dice.com/job-detail/ebbc2bff-1b87-4941-9427-56408de4a0ae?searchlink=search%2F%3Fq%3Ddeveloper%26location%3DUnited%2520States%26latitude%3D37.09024%26longitude%3D-95.712891%26countryCode%3DUS%26locationPrecision%3DCountry%26radius%3D30%26radiusUnit%3Dmi%26page%3D1%26pageSize%3D100%26filters.postedDate%3DONE%26filters.employmentType%3DCONTRACTS%26language%3Den%26eid%3DS2Q_&searchId=57de37fe-6ab8-4fe2-a138-eaa68f3150d1,Posted 18 hours ago,Dice,contract
