job_title,company_name,address,job_description,job_source_url,job_posted_date,job_source,job_type
Senior Rust Developer,Accolite Digital LLC,"Englewood, CO, USA","Role: Senior Rust DeveloperLocation: Onsite in Englewood, CO Long term contract About the Role: We are seeking a Senior Rust Engineer to join our Denver, Colorado based client team. This person should possess significant Software Engineering experience and have the ability to mentor junior team members. This position is within our client’s video streaming backend team. This team is responsible for ensuring a high-quality video streaming experience for all of our customers - from source ingest",https://www.dice.com/jobs?q=developer&location=United%20States&latitude=37.09024&longitude=-95.712891&countryCode=US&locationPrecision=Country&radius=30&radiusUnit=mi&page=3&pageSize=100&filters.postedDate=ONE&filters.employmentType=CONTRACTS&language=en&eid=S2Q_,Posted 21 hours ago,Dice,Contract
.NET Developer,Comtech Global,"Columbus, OH, USA","Role : . Net Developer Location: Columbus OH Short Description: Programmer 5 with expertise in web development using Microsoft .NET technologies. Project to support the applications of the Emergency Medical Services Division of DPS Complete Description: .NET Developer DESCRIPTION: The selected Consultants will work closely with the designated IT supervisor, project managers and other developers in an agile development environment. The work scope of the consultant will include requirements gat",https://www.dice.com/jobs?q=developer&location=United%20States&latitude=37.09024&longitude=-95.712891&countryCode=US&locationPrecision=Country&radius=30&radiusUnit=mi&page=3&pageSize=100&filters.postedDate=ONE&filters.employmentType=CONTRACTS&language=en&eid=S2Q_,Posted 20 hours ago,Dice,Contract
Ab Initio Developer,Teamware Solutions,"Cleveland, OH, USA","Job Role: Ab Initio Developer Location: Cleveland, OH (Day 1 Onsite) Duration: 06+ Months MUST HAVE: 9+ years of experience (Mandatory)6+ years of hands-on experience (Mandatory)AbInitio, UNIX, Teradata, Hadoop, Google BigQuery, Google cloud Storage, Basics of Data processing tools in Google Cloud Platform and Python BasicsShould have minimum 5+ years of hands-on experience with Ab Initio ETL toolShould have minimum 1+ years of hands-on experience with Google Cloud TechnologiesBasics of PyhtonSh",https://www.dice.com/jobs?q=developer&location=United%20States&latitude=37.09024&longitude=-95.712891&countryCode=US&locationPrecision=Country&radius=30&radiusUnit=mi&page=3&pageSize=100&filters.postedDate=ONE&filters.employmentType=CONTRACTS&language=en&eid=S2Q_,Posted moments ago,Dice,Contract
SQL Developer - Day 1 Onsite,Talent Hires,"Chicago, IL, USA","Hi, Hope you are doing great, Urgent Need for SQL Developer Experience : 11+ Minimum Work Location : Chicago, Illinois RESPONSIBILITIES/TASKS: Analyze current environment based on monitoring tools, logs, SQL Assist with design and specification of SQL Database environment based on load requirements Present options and collaborate with stakeholders and DBA team on best approaches Identify dependencies and changes requires for database migration in Stored Procs, SSIS Packages, SSRS Reports, Trig",https://www.dice.com/jobs?q=developer&location=United%20States&latitude=37.09024&longitude=-95.712891&countryCode=US&locationPrecision=Country&radius=30&radiusUnit=mi&page=3&pageSize=100&filters.postedDate=ONE&filters.employmentType=CONTRACTS&language=en&eid=S2Q_,Posted 1 hour ago,Dice,Contract
.NET - Azure software developer,Hirex,"San Bernardino, CA, USA","Hi, Hope you are safe and doing well today. This is Pratibha from HireX. I'm trying to reach you regarding the below job opening so please have a look and do let me know if you are interested. Title :: .NET - Azure software developer Location :: San Bernardino, CA (Local in Los Angeles or San Bernardino) Duration :: 12 Months + multiple years extensions Interview :: Video conference call Conditions of Employment LiveScan/Finger Printing: All candidates are required to complete their Li",https://www.dice.com/jobs?q=developer&location=United%20States&latitude=37.09024&longitude=-95.712891&countryCode=US&locationPrecision=Country&radius=30&radiusUnit=mi&page=3&pageSize=100&filters.postedDate=ONE&filters.employmentType=CONTRACTS&language=en&eid=S2Q_,Posted 23 hours ago,Dice,Contract
"Senior Java Developer in Richmond, VA (HYBRID) - 703841","Super Technology Solutions, Inc.","Richmond, VA, USA","One of our premier clients is looking for a Senior Java Developer in Richmond, VA (HYBRID) for a Contract position. If interested, please submit your resume ASAP indicating (1) current location (2) desired hourly rate (3) Your email address. REQUIRED SKILLS: Solid understanding of Object Oriented Design Methodology and Design Patterns like Singleton, Factory, Observer, Proxy, Demand, etc.Expertise in Core Java concepts, such as OOP Design, Multi-Threading, Generics, Exception Handling, Collecti",https://www.dice.com/jobs?q=developer&location=United%20States&latitude=37.09024&longitude=-95.712891&countryCode=US&locationPrecision=Country&radius=30&radiusUnit=mi&page=3&pageSize=100&filters.postedDate=ONE&filters.employmentType=CONTRACTS&language=en&eid=S2Q_,Posted 2 hours ago,Dice,Contract
Python Developer,ePeople Technologies Inc,"Charlotte, NC, USA","Title: Python Developer Location: Charlotte, NC ( Hybrid 3 days in a week permanently ) Duration: Contract Role Need candidate is for onsite interview Required Skills 8+ years of experience in Python programming.Strong knowledge of Python libraries like Pandas and NumPyExperience in frameworks like Django, Flask or any other web frameworksExperience in UI library or Framework such as React, Angular or Vue (Preferred React)Proficient with Data structures and CollectionsExperience in Relational (",https://www.dice.com/jobs?q=developer&location=United%20States&latitude=37.09024&longitude=-95.712891&countryCode=US&locationPrecision=Country&radius=30&radiusUnit=mi&page=3&pageSize=100&filters.postedDate=ONE&filters.employmentType=CONTRACTS&language=en&eid=S2Q_,Posted 22 hours ago,Dice,Contract
Alfresco Developer,Teamware Solutions,"Plano, TX, USA","Job Role: Alfresco Developer Location: Plano, TX (Hybrid) Duration: 06+ Months JOB DESCRIPTION: 8 to 12+ years of Hand on Experience in Auto FinanceSpecific technology areas and responsibilities include:Alfresco Share and ADF, ADW, Alfresco Process AutomationUsing Alfresco application clustering to support distributed processing so that the solution supports High Availability (HA) and failover in the event of an issue with the primary deploymentIntegrating Alfresco solutions with enterprise appl",https://www.dice.com/jobs?q=developer&location=United%20States&latitude=37.09024&longitude=-95.712891&countryCode=US&locationPrecision=Country&radius=30&radiusUnit=mi&page=3&pageSize=100&filters.postedDate=ONE&filters.employmentType=CONTRACTS&language=en&eid=S2Q_,Posted moments ago,Dice,Contract
Salesforce Administrator/ Developer,Ascendion Inc.,"St. Louis, MO, USA","About Ascendion Ascendion is a full-service digital engineering solutions company. We make and manage software platforms and products that power growth and deliver captivating experiences to consumers and employees. Our engineering, cloud, data, experience design, and talent solution capabilities accelerate transformation and impact for enterprise clients. Headquartered in New Jersey, our workforce of 6,000+ Ascenders delivers solutions from around the globe. Ascendion is built differently to e",https://www.dice.com/jobs?q=developer&location=United%20States&latitude=37.09024&longitude=-95.712891&countryCode=US&locationPrecision=Country&radius=30&radiusUnit=mi&page=3&pageSize=100&filters.postedDate=ONE&filters.employmentType=CONTRACTS&language=en&eid=S2Q_,Posted moments ago,Dice,Contract
Senior Frontend React.JS Developer,HireBlazer,"Remote or Austin, TX, USA","Role: Senior Frontend React.JS Developer Location: Austin, TX (Remote) Contract: 5 Months(3 Yrs Ext) Job Description: Client will require the Worker to work on the following initiatives and will perform advanced analysis/programming tasks such as:Participating in all phases of SDLC, including design, software development and code review.Performing extensive code reviews and analysis.Writing reports on code analysis to determine if industry standards and best practices are being followed; provide",https://www.dice.com/jobs?q=developer&location=United%20States&latitude=37.09024&longitude=-95.712891&countryCode=US&locationPrecision=Country&radius=30&radiusUnit=mi&page=3&pageSize=100&filters.postedDate=ONE&filters.employmentType=CONTRACTS&language=en&eid=S2Q_,Posted 20 hours ago,Dice,Contract
Senior Java Developer,C&G Consulting Services,"Jersey City, NJ, USA","Senior Java Developer Job Description: Work in an agile and fast-paced environment interfacing with management, business and senior technology membersUnderstand technical and Business processes of various front office, trading and settlement applicationsUnderstand business requirements, processes and specifications required to support implementationCommunicate and coordinate effectively with business analysts and cross functional technology teamsDocument technical specifications, functional fl",https://www.dice.com/jobs?q=developer&location=United%20States&latitude=37.09024&longitude=-95.712891&countryCode=US&locationPrecision=Country&radius=30&radiusUnit=mi&page=3&pageSize=100&filters.postedDate=ONE&filters.employmentType=CONTRACTS&language=en&eid=S2Q_,Posted 3 hours ago,Dice,Contract
"Hybrid role :: SQL Developer :: Hartford, CT Onsite from day 1 :: 12+ Months Contract",JBS Technologies,"Hartford, CT, USA","Hi, Greetings! This is Abhishek from JBS Technologies. We are a global recruitment company with specialization in hiring IT Professionals. One of our clients is looking for SQL Developer | Hartford, CT – Onsite from day 1. JOB SUMMARY Role: SQL Developer Location: Hartford, CT – Onsite from day 1 Duration : 12+ Months Contract MOI : Phone/Skype Description: A senior software engineer must have a vast array of technical skills and should be confident using programming langua",https://www.dice.com/jobs?q=developer&location=United%20States&latitude=37.09024&longitude=-95.712891&countryCode=US&locationPrecision=Country&radius=30&radiusUnit=mi&page=3&pageSize=100&filters.postedDate=ONE&filters.employmentType=CONTRACTS&language=en&eid=S2Q_,Posted 23 hours ago,Dice,Contract
Microsoft Power Platform/Power BI Developer,Fusion IT Inc,"Boston, MA, USA","Job Title : Microsoft Power Platform/Power BI Developer Location : Bostan, MA - Hybrid Role (2 days per week) Contract Job Description : Qualifications: Experience with Microsoft Power BI, Power Apps, and Power Automate experience – part of Power BI;SQL Server experience – ability to write complex queries;Familiarity with scripting and programmingExperience developing PowerApps model.Good working knowledge of Power Queries.MS Power BI suite (Power Query/M/DAX).4+ years of experience with Power",https://www.dice.com/jobs?q=developer&location=United%20States&latitude=37.09024&longitude=-95.712891&countryCode=US&locationPrecision=Country&radius=30&radiusUnit=mi&page=3&pageSize=100&filters.postedDate=ONE&filters.employmentType=CONTRACTS&language=en&eid=S2Q_,Posted 4 hours ago,Dice,Contract
"Senior. Net Developer w/Blazor exp. in Richmond, VA (HYBRID) - 706703","Super Technology Solutions, Inc.","Richmond, VA, USA","One of our premier clients is looking for a Senior. Net Developer w/Blazor exp. in Richmond, VA (HYBRID) for a Contract position. If interested, please submit your resume ASAP indicating (1) current location (2) desired hourly rate (3) Your email address. RESPONSIBILITIES: Develop web applications and backend services using C#, ASP.NET MVC,, Angular, REST API, .NET Core, Java Script, JQuery, Node.js and CSS. Design and develop database objects in SQL Server.Design and develop using appropriate",https://www.dice.com/jobs?q=developer&location=United%20States&latitude=37.09024&longitude=-95.712891&countryCode=US&locationPrecision=Country&radius=30&radiusUnit=mi&page=3&pageSize=100&filters.postedDate=ONE&filters.employmentType=CONTRACTS&language=en&eid=S2Q_,Posted 3 hours ago,Dice,Contract
"Need of SOA Developer @ Mclean, VA (Onsite from Day-1)","E-Solutions, Inc.","McLean, VA, USA","Job Role- SOA Developer Location - Mclean, VA (Onsite from Day-1) Need to strong in Oracle SOA and OSB and WebLogic. Responsibilities: Create / debug detail design and implementation specifications Writes / debugs application code and performs unit and functional testing in order to provide technical solutions for the business. Be a hands-on team member. Responsible for designing and developing service-oriented solution logic as services. Facilitate the integration of SOA application packages",https://www.dice.com/jobs?q=developer&location=United%20States&latitude=37.09024&longitude=-95.712891&countryCode=US&locationPrecision=Country&radius=30&radiusUnit=mi&page=3&pageSize=100&filters.postedDate=ONE&filters.employmentType=CONTRACTS&language=en&eid=S2Q_,Posted 22 hours ago,Dice,Contract
UI Front-end - Vue.JS Developer,Proactive Staffing,"Cherry Hill, NJ, USA","UI Front-end - Vue.JS Developer Minimum 5 years experience with at least 3 focused on JavaScript UI development. General Responsibilities Design and develop front-end code for our applications Interact with business users, development leads and other stakeholders to understand and clarify business and system requirements Work collaboratively with back-end developers to integrate UI applications with REST services Identify opportunities to improve interface consistency and accessibility Contribut",https://www.dice.com/jobs?q=developer&location=United%20States&latitude=37.09024&longitude=-95.712891&countryCode=US&locationPrecision=Country&radius=30&radiusUnit=mi&page=3&pageSize=100&filters.postedDate=ONE&filters.employmentType=CONTRACTS&language=en&eid=S2Q_,Posted 7 hours ago,Dice,Contract
Lead .Net developer,Zyreoneconsulting LLC,"Concord, CA, USA","Location: Concord,CA , Encino,CA : Atlanta Hybrid position Visa : All Visas are good The client looking for 15 years Senior .Net lead developer Responsibilities: Design, code, debug and develop high performance and high availability scalable applications Document key SDLC processes by producing formal documents like Solution Architecture Document and Technical System Design Specifications, etc. Software analysis, code analysis, requirements analysis, software review, identification of code met",https://www.dice.com/jobs?q=developer&location=United%20States&latitude=37.09024&longitude=-95.712891&countryCode=US&locationPrecision=Country&radius=30&radiusUnit=mi&page=3&pageSize=100&filters.postedDate=ONE&filters.employmentType=CONTRACTS&language=en&eid=S2Q_,Posted 3 hours ago,Dice,Contract
Oracle Webcenter Sites Developer ||Atlanta GA (Onsite),Noralogic Inc,"Atlanta, GA, USA",Oracle Webcenter Sites Developer Atlanta GA (Onsite From day-1) Long Term Contract Description: Client is looking for highly energetic and collaborative Oracle Webcenter Sites Developer in leading Implementations and solution architecture for Content Server Applications built on Oracle WebCenter Sites 12C/11g Middleware platform formerly known as FatWire Web Content Management. The ideal candidate is expected to be an expert in providing architectural solutions for Oracle WebCenter Sites 11g &,https://www.dice.com/jobs?q=developer&location=United%20States&latitude=37.09024&longitude=-95.712891&countryCode=US&locationPrecision=Country&radius=30&radiusUnit=mi&page=3&pageSize=100&filters.postedDate=ONE&filters.employmentType=CONTRACTS&language=en&eid=S2Q_,Posted 4 hours ago,Dice,Contract
"Principal Integrations developer with Boomi, Mule ESB or webMethods- Atlanta, GA - 3days hybrid",Cyber Sphere LLC,"Atlanta, GA, USA","Job title: Principal Integrations developer location: Atlanta, GA - 3days hybridFULLTIME They prefer someone local who can be onsite 3 days a week but are willing to be flexible for a senior-level candidate. Skills:Boomi, Mule ESB or webMethods experience is probably the most pressing skill. Some of the important things you will do in this role:Develop in-depth knowledge of the Supply Chain and Omnichannel domainsInteract heavily with technical architects and engineers on the customer side to",https://www.dice.com/jobs?q=developer&location=United%20States&latitude=37.09024&longitude=-95.712891&countryCode=US&locationPrecision=Country&radius=30&radiusUnit=mi&page=3&pageSize=100&filters.postedDate=ONE&filters.employmentType=CONTRACTS&language=en&eid=S2Q_,Posted 4 hours ago,Dice,Contract
Full Stack .NET Developer,K-Tek Resourcing LLC,"Rancho Cucamonga, CA, USA","Good Morning, Greetings for the day! I just got a few excellent opportunities for Full Stack .NET Developer/Hands on Architect with Azure Its an onsite position at Rancho Cucamonga, CA A very quick fill role with immediate interviews. Duties and Responsibilities Manage the end-to-end life cycle for the production of software and applications (Agile/DevOps)Communicate efficiently/effectively with all internal/external business entities.Maintain/Implement efficient, highly testable code.",https://www.dice.com/jobs?q=developer&location=United%20States&latitude=37.09024&longitude=-95.712891&countryCode=US&locationPrecision=Country&radius=30&radiusUnit=mi&page=3&pageSize=100&filters.postedDate=ONE&filters.employmentType=CONTRACTS&language=en&eid=S2Q_,Posted 5 hours ago,Dice,Contract
Data Warehouse Developer II - REMOTE (4077),Flexion Inc,"Madison, WI, USA","Flexion Inc. a Madison, WI based IT Consulting and Services firm is looking for a Data Warehouse Developer II to work on a long-term consulting project. The client for this position is based in Madison, WI. The most efficient way to reach our recruiting team is to submit your resume through the URL provided. If you have questions or would like more information about this job posting, or if would like to know more about Flexion Inc. please contact Christina Newman at The candidate in this positi",https://www.dice.com/jobs?q=developer&location=United%20States&latitude=37.09024&longitude=-95.712891&countryCode=US&locationPrecision=Country&radius=30&radiusUnit=mi&page=3&pageSize=100&filters.postedDate=ONE&filters.employmentType=CONTRACTS&language=en&eid=S2Q_,Posted 5 hours ago,Dice,Contract
Senior Node.js Microservices (Backend) Developer,S4 Analytics,"Dallas, TX, USA","Job Description: We are looking for a highly skilled Senior Node.js Microservices Developer with expertise in building microservices using Node/Java and GO. The ideal candidate will have a minimum of 6 years of experience in Node.js development, with expert-level proficiency, and a strong understanding of building highly scalable systems using cloud and edge computing. Key Responsibilities: Design and develop highly scalable microservices using Node/Java and GO. Build and manage Kubernetes clus",https://www.dice.com/jobs?q=developer&location=United%20States&latitude=37.09024&longitude=-95.712891&countryCode=US&locationPrecision=Country&radius=30&radiusUnit=mi&page=3&pageSize=100&filters.postedDate=ONE&filters.employmentType=CONTRACTS&language=en&eid=S2Q_,Posted 20 hours ago,Dice,Contract
Salesforce Developer,4 Consulting Inc,"Panthersville, GA, USA","Who we are! At 4Ci our mission is to build long term relationships, based on trust, integrity, and knowledge with all our employees and business affiliates. 4Ci has been in business for 20 years and has employees working on mission critical projects nationwide. We provide computer programming, testing, and system design services to develop and maintain multi-year, multi-million-dollar mission critical applications for the US Government. Examples of such applications are Medicaid MMIS systems, He",https://www.dice.com/jobs?q=developer&location=United%20States&latitude=37.09024&longitude=-95.712891&countryCode=US&locationPrecision=Country&radius=30&radiusUnit=mi&page=3&pageSize=100&filters.postedDate=ONE&filters.employmentType=CONTRACTS&language=en&eid=S2Q_,Posted 20 hours ago,Dice,Contract
Java AWS Developer,Synkriom,"Plano, TX, USA","Title : JAVA AWS Developer/ Lead Location: Plano, TX Duration: Long Term Mandatory skills Front end: Angular 12 & above/ React js Backend: Java 11 & REST based microservices Spring Boot Cloud : AWS ,PCF CI/CD Pipeline Tools: Splunk, Dynatrace. Job description” 12+ years of application development experience with developing enterprise level cloud based application (AWS based).Experience developing in a microservices architecture using Docker containers.Experience developing for Amazon Web Ser",https://www.dice.com/jobs?q=developer&location=United%20States&latitude=37.09024&longitude=-95.712891&countryCode=US&locationPrecision=Country&radius=30&radiusUnit=mi&page=3&pageSize=100&filters.postedDate=ONE&filters.employmentType=CONTRACTS&language=en&eid=S2Q_,Posted moments ago,Dice,Contract
Informatica Developer,"Veritis Group, Inc.","Horsham, PA, USA","Title: Informatica Developer Duration: 6 Month Contract to Hire Location: Horsham, PA 19044 2 days’ remote; 3 days’ on-site Responsibilities Informatica Power Center development with an emphasis on working with a diverse set of sources and targets, implementing auditing, error trapping/tracking, reusability and restartablilty, and the ability to troubleshoot and performance tune Informatica mappings, sessions and workflowsDevelopment of Informatica Power Exchange CDC Data Mappings and workflow",https://www.dice.com/jobs?q=developer&location=United%20States&latitude=37.09024&longitude=-95.712891&countryCode=US&locationPrecision=Country&radius=30&radiusUnit=mi&page=3&pageSize=100&filters.postedDate=ONE&filters.employmentType=CONTRACTS&language=en&eid=S2Q_,Posted 20 hours ago,Dice,Contract
Senior Power BI Developer,Ampcus Inc,"Irving, TX, USA","Position: Power BI. Sr Developer Work Location: IRVING, TX (Hybrid) Duration: 8+months Job description: Person will be responsible for Power BI reports and Dashboard developments. Prior experience with Oracle ERP is preferred. Developer should bring creativity in developing solution and utilizes features of Power BI, not just table-based reporting. Data Modelling experience is nice to have. Skillsets Required: Domain 1: Perform Discovery and Determine Scope Analyze data via SQL queries to as",https://www.dice.com/jobs?q=developer&location=United%20States&latitude=37.09024&longitude=-95.712891&countryCode=US&locationPrecision=Country&radius=30&radiusUnit=mi&page=3&pageSize=100&filters.postedDate=ONE&filters.employmentType=CONTRACTS&language=en&eid=S2Q_,Posted 22 hours ago,Dice,Contract
Java Backend Developer (Hybrid Weekly 2Days To office ),Khayainfotech,"New York, NY, USA","Hi, Job Title: Java Backend Developer Duration: Long-Term Contract. Location: New York, NY (Hybrid Weekly 2Days To office ) Must-Have : 10+ Years of Java DevelopmentStrong in Spring boot.Strong in MicroservicesAWS Cloud engineer Degree in Computer Science or equivalent experienceAdvanced experience with Java/J2EE technologies like Spring boot framework, Microservices REST APIs, JSON, Java StackAdvanced Microservices architecture working experienceStrong foundation in algorithms, data structure",https://www.dice.com/jobs?q=developer&location=United%20States&latitude=37.09024&longitude=-95.712891&countryCode=US&locationPrecision=Country&radius=30&radiusUnit=mi&page=3&pageSize=100&filters.postedDate=ONE&filters.employmentType=CONTRACTS&language=en&eid=S2Q_,Posted 4 hours ago,Dice,Contract
ETL INFORMATICA DEVELOPER-DIRECT CLIENT,"DATAMAXIS, Inc","Remote or Springfield, IL, USA","ETL/Informatica Developer Rate: Depends on Experience remote, candidates local to Springfield, IL area preferred. Preferred Qualifications: 5+ years of Data Warehouse experienceExperience in Reporting/Analytics tool shall be a plus (SAP BO, Tableau, SAS, PowerBI)Experience in Windows, Unix/Linux scripting, R, React, or PythonExperience in Informatica Data Quality (IDQ), Address Doctor, Metadata ManagerExperience with State Medicaid / Medicare / Healthcare applicationsETL/Informatica or SQL",https://www.dice.com/jobs?q=developer&location=United%20States&latitude=37.09024&longitude=-95.712891&countryCode=US&locationPrecision=Country&radius=30&radiusUnit=mi&page=3&pageSize=100&filters.postedDate=ONE&filters.employmentType=CONTRACTS&language=en&eid=S2Q_,Posted 6 hours ago,Dice,Contract
Sailpoint Developer,Net2Source Inc.,"Malvern, PA, USA","Net 2 Source Inc. is an award-winning total workforce solutions company recognized by Staffing Industry Analysts for our accelerated growth of 300% in the last 3 years with over 5500+ employees globally, with over 30+ locations in the US and global operations in 32 countries. We believe in providing staffing solutions to address the current talent gap Right Talent Right Time Right Place Right Price and acting as a Career Coach to our consultants. Job Title: Sailpoint Developer Location: Malve",https://www.dice.com/jobs?q=developer&location=United%20States&latitude=37.09024&longitude=-95.712891&countryCode=US&locationPrecision=Country&radius=30&radiusUnit=mi&page=3&pageSize=100&filters.postedDate=ONE&filters.employmentType=CONTRACTS&language=en&eid=S2Q_,Posted 19 hours ago,Dice,Contract
