job_title,company_name,address,job_description,job_source_url,job_posted_date,job_source,job_type
Developer,TechWish,"Manassas, VA, USA","Code, test, review Client software using technologies including C++, STL, Boost, Multithreading, Unix, Perl, Python and XML. Requirement analysis and Design of new features and enhancements to existing components. Produce / Update solution paper, design documents Support set-up of test environment, write unit test driver, functional drivers Provide support to test environment, QA and production as necessary C++ Multithreading - Junior (1-3) ( 3,00 years ) Development in UNIX / Linux - Professi",https://www.dice.com/jobs?q=developer&location=United%20States&latitude=37.09024&longitude=-95.712891&countryCode=US&locationPrecision=Country&radius=30&radiusUnit=mi&page=1&pageSize=100&filters.postedDate=ONE&filters.employmentType=CONTRACTS&language=en&eid=S2Q_,Posted moments ago,Dice,Contract
.NET Developer,"Phoenix Staff, Inc.","Phoenix, AZ, USA","Title: .NET Developer Location: Remote Type: Temporary Part-Time Contract; 20-40 hours/week depending on need, not to extend past end of September Your role: Work with developers, apps architect, scrum master, and customers to modernize existing legacy web application written in ASP.Net C#, .Net Framework 4.6.1, .Net Core 3.1.3, Bootstrap, API Development and using either Microsoft Visual Studio 2015, 2017, and 2019 to now interface with OnBase reporting.Participate in the SDLC from technical d",https://www.dice.com/jobs?q=developer&location=United%20States&latitude=37.09024&longitude=-95.712891&countryCode=US&locationPrecision=Country&radius=30&radiusUnit=mi&page=1&pageSize=100&filters.postedDate=ONE&filters.employmentType=CONTRACTS&language=en&eid=S2Q_,Posted moments ago,Dice,Contract
Database Developer,Robert Half,"San Antonio, TX, USA","Description Robert Half is currently looking for an ambitious Database Developer with experience to join a rapidly-growing company. In the role of Database Developer, you'll use your knowledge of database architecture to design, build, and develop systems. Candidates must be experts on query writing and have a passion for operational development. This long-term contract / temporary position is located in the San Antonio, Texas area. Your responsibilities - Generate an efficient method for s",https://www.dice.com/jobs?q=developer&location=United%20States&latitude=37.09024&longitude=-95.712891&countryCode=US&locationPrecision=Country&radius=30&radiusUnit=mi&page=1&pageSize=100&filters.postedDate=ONE&filters.employmentType=CONTRACTS&language=en&eid=S2Q_,Posted 18 hours ago,Dice,Contract
Local to Ohio - .Net Developer,Stellar Professionals LLC,"Columbus, OH, USA",Local to Ohio - .Net Developer Mode of interview: Webcam or In person Work arrangement: Hybrid Applicant must have 10 years of relevant experience with the following: Verifiable experience as a .NET Web Developer developing ASP.NET MVC applications Verifiable ASP.NET experience developing with the C Sharp (C#) language. Verifiable experience with Microservices. Verifiable experience with Microsoft C# .NET Core or .NET 5. Verifiable experience with SQL Server Database Design and development: opti,https://www.dice.com/jobs?q=developer&location=United%20States&latitude=37.09024&longitude=-95.712891&countryCode=US&locationPrecision=Country&radius=30&radiusUnit=mi&page=1&pageSize=100&filters.postedDate=ONE&filters.employmentType=CONTRACTS&language=en&eid=S2Q_,Posted 22 hours ago,Dice,Contract
Salesforce Developer,Lucid Technologies,"Chicago, IL, USA","Role/Title: - Salesforce Developer Location:- (Hybrid) Chicago, IllinoisExperience:- 5 yearsInterview : Either Webcam or in person \*\*Candidates should be local to Chicago and able to come in and work onsite at least 1 or 2 days a week.They also have the preference that they are able to come in and doing the interview onsite / in person so that way they can meet them General Description This need is for Salesforce Developers who will be supporting a well-known global Financial Services institut",https://www.dice.com/jobs?q=developer&location=United%20States&latitude=37.09024&longitude=-95.712891&countryCode=US&locationPrecision=Country&radius=30&radiusUnit=mi&page=1&pageSize=100&filters.postedDate=ONE&filters.employmentType=CONTRACTS&language=en&eid=S2Q_,Posted 22 hours ago,Dice,Contract
Application Developer,Randstad Technologies,"Sacramento, CA, USA","job summary: Our client is looking for an Application Developer for a 6 month hybrid contract position located in Sacramento, CA. This position has a high chance of extensions. location: Sacramento, California job type: Contract salary: $55 - 60 per hour work hours: 8am to 4pm education: Bachelors responsibilities: Our client is looking for an Application Developer for a 6 month hybrid contract position located in Sacramento, CA. This position has a high chance of extensions. Our cl",https://www.dice.com/jobs?q=developer&location=United%20States&latitude=37.09024&longitude=-95.712891&countryCode=US&locationPrecision=Country&radius=30&radiusUnit=mi&page=1&pageSize=100&filters.postedDate=ONE&filters.employmentType=CONTRACTS&language=en&eid=S2Q_,Posted 2 hours ago,Dice,Contract
Web Developer,Beacon Hill Technologies,"Newark, DE, USA","Our client in Newark is looking for a Web Developer to join their team. This is a hybrid role that requires 3 days a week on site. This position is a permanent position by way of contract to hire. Position Description: Adopt, implement, and ensure consistent look/feel of the UI. Deliver great and high-performing results through hands-on coding of both front/back-end technology solutions. Investigate and construct proof of concept introducing new and different technology solutions. Participate in",https://www.dice.com/jobs?q=developer&location=United%20States&latitude=37.09024&longitude=-95.712891&countryCode=US&locationPrecision=Country&radius=30&radiusUnit=mi&page=1&pageSize=100&filters.postedDate=ONE&filters.employmentType=CONTRACTS&language=en&eid=S2Q_,Posted 5 hours ago,Dice,Contract
Hybrid React Developer,Inspire Client LLC,"Baltimore, MD, USA","Role- React Developer Client: T.Rowe Price Location: Baltimore, MD (Pratt Street, must be onsite day 1 and adhere to the hybrid model) Visa: Green cards 6 months plus EXTN. JOB TITLE: React Developer DESCRIPTION: . In this role you will design, develop, modify, adapt and implement short- and long-term solutions to information technology needs through new and existing applications, systems, databases and applications infrastructure. You will review and interpret system requirements and busine",https://www.dice.com/jobs?q=developer&location=United%20States&latitude=37.09024&longitude=-95.712891&countryCode=US&locationPrecision=Country&radius=30&radiusUnit=mi&page=1&pageSize=100&filters.postedDate=ONE&filters.employmentType=CONTRACTS&language=en&eid=S2Q_,Posted 4 hours ago,Dice,Contract
"Java Developer - on site in Tallahassee, FL","Digital Intelligence Systems, LLC","Tallahassee, FL, USA","Job Title: Java/Oracle Developer - Multiyear contract - C2C avaialble - Must work on site in Tallahassee, FL Job Location: Tallahassee, FL Job Duration: 12+ months Job Overview: Primarily work with J2EE and Oracle DBMS applications. Job Responsibilities: Provide maintenance, enhancement and support for a variety of the agency's business applications. Assisting in the preparation and documentation of program requirements and specifications. Research and document requirements of program users.",https://www.dice.com/jobs?q=developer&location=United%20States&latitude=37.09024&longitude=-95.712891&countryCode=US&locationPrecision=Country&radius=30&radiusUnit=mi&page=1&pageSize=100&filters.postedDate=ONE&filters.employmentType=CONTRACTS&language=en&eid=S2Q_,Posted 5 hours ago,Dice,Contract
Senior Java Developer,CRG Corporation.,"Charlotte, NC, USA","Senior Java Developer Location: Charlotte, North Carolina (hybrid) Duration: 1 year, Contract to potential hire Pay: $60.00 +/hr JOB DESCRIPTION Our global client, headquartered in Charlotte, NC, is a world class food service provider with a top notch, state of the art technology stack. This innovative company provides employees with excellent work-life balance and prioritizes safety, health, and environment first. This company provides an excellent benefits package and is recognized for their g",https://www.dice.com/jobs?q=developer&location=United%20States&latitude=37.09024&longitude=-95.712891&countryCode=US&locationPrecision=Country&radius=30&radiusUnit=mi&page=1&pageSize=100&filters.postedDate=ONE&filters.employmentType=CONTRACTS&language=en&eid=S2Q_,Posted 18 hours ago,Dice,Contract
AEM Developer,Randstad Technologies,"Malvern, PA, USA","job summary: Responsibilities Collaborate with product owners, UX designers, data analysts, scrum masters, and developers to develop a world-class user experience. Recommend and effectively explain improvements in functionality, and UX elements that enable users to achieve their goals. Be an expert in building working relationships across divisions. Research, advocate and implement industry standard coding methodologies to improve workflows through the selection of evolving technologies and to",https://www.dice.com/jobs?q=developer&location=United%20States&latitude=37.09024&longitude=-95.712891&countryCode=US&locationPrecision=Country&radius=30&radiusUnit=mi&page=1&pageSize=100&filters.postedDate=ONE&filters.employmentType=CONTRACTS&language=en&eid=S2Q_,Posted 4 hours ago,Dice,Contract
Python Developer,Randstad Technologies,"Remote or Oakland, CA, USA","job summary: Description: Client brings together the best in media and technology. We drive innovation to create the world's best entertainment and online experiences. As a Fortune 40 leader, we set the pace in a variety of innovative and fascinating businesses and create career opportunities across a wide range of locations and disciplines. We are at the forefront of change and move at an amazing pace, thanks to our remarkable people, who bring cutting-edge products and services to life for mi",https://www.dice.com/jobs?q=developer&location=United%20States&latitude=37.09024&longitude=-95.712891&countryCode=US&locationPrecision=Country&radius=30&radiusUnit=mi&page=1&pageSize=100&filters.postedDate=ONE&filters.employmentType=CONTRACTS&language=en&eid=S2Q_,Posted 2 hours ago,Dice,Contract
Python Developer,Precision Technologies Corp,"Florida, NY, USA","We are looking for an experienced Python developer to join our engineering team and help us create dynamic software applications for our clients. In this role, you will be responsible for writing and testing scalable code, developing back-end components, and integrating user-facing elements in collaboration with front-end developers. To be successful as a Python developer, you should possess in-depth knowledge of object-relational mapping, experience with server-side logic, and above-average kn",https://www.dice.com/jobs?q=developer&location=United%20States&latitude=37.09024&longitude=-95.712891&countryCode=US&locationPrecision=Country&radius=30&radiusUnit=mi&page=1&pageSize=100&filters.postedDate=ONE&filters.employmentType=CONTRACTS&language=en&eid=S2Q_,Posted moments ago,Dice,Contract
Salesforce Developer,Precision Technologies Corp,"Newark, NJ, USA","A Salesforce developer has a lot of work to manage. They should be able to handle the client's problems and manage all their peers. Since it's a cloud-based software there are regular updates in Salesforce which needs to be monitored frequently. Some of the responsibilities in a Salesforce developer job are as follows- Responsible for making specialized plans and procedures for different offices and the IT groups, creating answers for the location of any far-reaching issues, and making their pro",https://www.dice.com/jobs?q=developer&location=United%20States&latitude=37.09024&longitude=-95.712891&countryCode=US&locationPrecision=Country&radius=30&radiusUnit=mi&page=1&pageSize=100&filters.postedDate=ONE&filters.employmentType=CONTRACTS&language=en&eid=S2Q_,Posted moments ago,Dice,Contract
Python Developer,TekShapers,"New York, NY, USA","Python Developer Location: NYC, NY Day one Onsite Should Minimum 3-4 years Python experience Person should have Python core backend development experience Client is not looking for frontend Python developer Person should be have good Object Oriented programming concepts Should have experience in Panda, NumPy, PySpark libraries and DataBricks (Good to have) They use Backend as Sybase and Snowflakes so experience with RDBMS is must Person should be able to manipulate data using Python They are",https://www.dice.com/jobs?q=developer&location=United%20States&latitude=37.09024&longitude=-95.712891&countryCode=US&locationPrecision=Country&radius=30&radiusUnit=mi&page=1&pageSize=100&filters.postedDate=ONE&filters.employmentType=CONTRACTS&language=en&eid=S2Q_,Posted 3 hours ago,Dice,Contract
Salesforce Marketing Cloud Developer,"TekLeaders, Inc","Westlake, TX, USA","Role: Salesforce Marketing Cloud Developer Location: Westlake, TX (hybrid) Duration: 12+ Months Job Description: Salesforce Marketing Cloud Developer Your Opportunity Schwab is looking for a Salesforce Marketing Cloud developer with experience working with Marketing Cloud in the Operational Excellence Technology organization. This organization manages the platforms and systems delivering capabilities to our marketing business partners. As a member of the Operational Excellence Technology team,",https://www.dice.com/jobs?q=developer&location=United%20States&latitude=37.09024&longitude=-95.712891&countryCode=US&locationPrecision=Country&radius=30&radiusUnit=mi&page=1&pageSize=100&filters.postedDate=ONE&filters.employmentType=CONTRACTS&language=en&eid=S2Q_,Posted moments ago,Dice,Contract
Full Stack Developer,INSPYR Solutions,"Remote or Houston, TX, USA","Title: Full Stack .NET Developer Location: Houston, TX (REMOTE, but must be local) Duration: 1+ yearlong contract Work Requirements: US Citizen, GC Holders or Authorized to Work in the US Qualified candidates may send a copy of their resume (Word Format) to Mike Sabo at MSabo@inspyrsolutions.com Job Description: We are seeking a dedicated full-stack developer to join our growing company. You will be tasked with taking website template files from a designer and creating fully functional websites",https://www.dice.com/jobs?q=developer&location=United%20States&latitude=37.09024&longitude=-95.712891&countryCode=US&locationPrecision=Country&radius=30&radiusUnit=mi&page=1&pageSize=100&filters.postedDate=ONE&filters.employmentType=CONTRACTS&language=en&eid=S2Q_,Posted 1 day ago,Dice,Contract
"Core Java, J2EE Developer",Randstad Technologies,"Charlotte, NC, USA","job summary: Key Responsibilities : Building the Solution Right Design, develop and be accountable for feature delivery. Apply enterprise standards for solution design, coding and quality. Ensure solution meets product acceptance criteria with minimal technical debt. Responsible for compliance and security items and audit support at the team level. Act as a liaison for production activities/issues. Work Planning and Execution Work with the Product Owner to ensure that product backlog/requiremen",https://www.dice.com/jobs?q=developer&location=United%20States&latitude=37.09024&longitude=-95.712891&countryCode=US&locationPrecision=Country&radius=30&radiusUnit=mi&page=1&pageSize=100&filters.postedDate=ONE&filters.employmentType=CONTRACTS&language=en&eid=S2Q_,Posted 5 hours ago,Dice,Contract
Senior UI Developer,Randstad Technologies,"Washington, DC, USA","job summary: Citizenship Requirement: YesWork Experience: Seeking a Senior Applications Developer to continue development of an existing web application suite: - Experience developing complex applications using Entity Framework Code First and front-end technologies such as Angular, HTML5, Bootstrap, CSS3, JQuery, SQL Server, REST API. - Familiarity with SharePoint and developing interfaces to SharePoint sites is a MUST - Experience in the following UX disciplines: information architecture, v",https://www.dice.com/jobs?q=developer&location=United%20States&latitude=37.09024&longitude=-95.712891&countryCode=US&locationPrecision=Country&radius=30&radiusUnit=mi&page=1&pageSize=100&filters.postedDate=ONE&filters.employmentType=CONTRACTS&language=en&eid=S2Q_,Posted 2 hours ago,Dice,Contract
Senior Software Developer - Fully Remote,Randstad Technologies,"Remote or Overland Park, KS, USA","job summary: Randstad Technologies is seeking a Senior Software Developer for an exciting fully remote contract role with one of our Kansas City area clients. Preferred candidate will bring the following qualifications: -Minimum of five years of experience in the following IT solution development disciplines: technical or infrastructure architecture, application development, database integration and cloud development. -Primary development experience with React, Node.js, Web Workers, and Python.",https://www.dice.com/jobs?q=developer&location=United%20States&latitude=37.09024&longitude=-95.712891&countryCode=US&locationPrecision=Country&radius=30&radiusUnit=mi&page=1&pageSize=100&filters.postedDate=ONE&filters.employmentType=CONTRACTS&language=en&eid=S2Q_,Posted 2 hours ago,Dice,Contract
Basic Visual .NET Developer,Randstad Technologies,"Orlando, FL, USA","job summary: Are you a Basic Visual .NET Developer looking to grow your career with a Fortune 100 company with high international brand recognition? If so, we have a contract position with the opportunity to convert to a permanent employee. This position offers excellent pay, benefits, and an opportunity to work with one of the top leaders in the IT and entertainment space. Required Skills: - 2+ years experience in Python preferred - 2+ years experience in Airflow preferred - 5+ years experi",https://www.dice.com/jobs?q=developer&location=United%20States&latitude=37.09024&longitude=-95.712891&countryCode=US&locationPrecision=Country&radius=30&radiusUnit=mi&page=1&pageSize=100&filters.postedDate=ONE&filters.employmentType=CONTRACTS&language=en&eid=S2Q_,Posted 23 hours ago,Dice,Contract
ON-SITE - COBOL Developer - HBITS-04-12689,"GreyCell Labs, Inc","Albany, NY, USA","Job Title: ON-SITE - COBOL Developer - HBITS-04-12689 Location: Albany New York, 12243 Duration: Long-term Job Description: 60 months experience working directly with COBOL 74 and/or 85 programming on Unisys 2200 series or ClearPath mainframes.60 months experience with system analysis and design, programming and unit and integrated testing on Unisys 2200 series or Clear Path mainframes.60 months experience utilizing Unisys ECL and DMS 2200/RDMS.60 months experience monitoring production work an",https://www.dice.com/jobs?q=developer&location=United%20States&latitude=37.09024&longitude=-95.712891&countryCode=US&locationPrecision=Country&radius=30&radiusUnit=mi&page=1&pageSize=100&filters.postedDate=ONE&filters.employmentType=CONTRACTS&language=en&eid=S2Q_,Posted 21 hours ago,Dice,Contract
Direct Client: Senior CICS System Developer,Incipient Corp.,"Jackson, MS, USA","Role: Programmer(Sr CICS System Developer) Duration: Long Term Location: Jackson, MS(Hybrid; Required to be onsite at least one week per month) Job Description: JOB DESCRIPTION Someone who is well versed in Mainframe/Linux COBOL/CICS systems. A solid knowledge of Microfocus COBOL and complex CICS based architecture system on a Linux based operating system with multiple file interaction with ADABAS, sequential file formats as well as Relational Database Systems. REQUIRED SKILL/EXPERIENCE Minimu",https://www.dice.com/jobs?q=developer&location=United%20States&latitude=37.09024&longitude=-95.712891&countryCode=US&locationPrecision=Country&radius=30&radiusUnit=mi&page=1&pageSize=100&filters.postedDate=ONE&filters.employmentType=CONTRACTS&language=en&eid=S2Q_,Posted 23 hours ago,Dice,Contract
Senior React Developer,Eliassen Group,"Baltimore, MD, USA","**Hybrid - 1-2 days onsite in Baltimore, MD.** Our financial services client is looking for a Senior React Developer to join their team. We will accept corp to corp or w2 contractors. For our w2 consultants, we offer a great benefits package that includes Medical, Dental, and Vision benefits, 401k with company matching, and life insurance. Responsibilities of the Senior React Developer: Act as a domain expert in one or more parts of the software lifecycle (e.g., coding, testing, deployment) L",https://www.dice.com/jobs?q=developer&location=United%20States&latitude=37.09024&longitude=-95.712891&countryCode=US&locationPrecision=Country&radius=30&radiusUnit=mi&page=1&pageSize=100&filters.postedDate=ONE&filters.employmentType=CONTRACTS&language=en&eid=S2Q_,Posted 10 hours ago,Dice,Contract
Python Developer,Eliassen Group,"Baltimore, MD, USA","**Hybrid - 1-2 days onsite in Baltimore, MD.** Our financial services client is looking for a Python Developer to join their team. We will accept corp to corp or w2 contractors. For our w2 consultants, we offer a great benefits package that includes Medical, Dental, and Vision benefits, 401k with company matching, and life insurance. Responsibilities of the Python Developer: Act as a domain expert in one or more parts of the software lifecycle Lead significant pieces of development within the",https://www.dice.com/jobs?q=developer&location=United%20States&latitude=37.09024&longitude=-95.712891&countryCode=US&locationPrecision=Country&radius=30&radiusUnit=mi&page=1&pageSize=100&filters.postedDate=ONE&filters.employmentType=CONTRACTS&language=en&eid=S2Q_,Posted 10 hours ago,Dice,Contract
Python developer,Denken Solutions,"Memphis, NY, USA","Role: Jr. Python Developer Location: Atlanta GA, Duration: Long Term Contract: W2 (Full Time) Responsibilities Write effective, scalable code Develop back-end components to improve responsiveness and overall performance Integrate user-facing elements into applications Test and debug programs Improve functionality of existing systems Implement security and data protection solutions Assess and prioritize feature requests Coordinate with internal teams to understand user requirements and provide",https://www.dice.com/jobs?q=developer&location=United%20States&latitude=37.09024&longitude=-95.712891&countryCode=US&locationPrecision=Country&radius=30&radiusUnit=mi&page=1&pageSize=100&filters.postedDate=ONE&filters.employmentType=CONTRACTS&language=en&eid=S2Q_,Posted 23 hours ago,Dice,Contract
Database Developer with AWS,Purple Drive Technologies LLC,"Plano, TX, USA","Position: Database Developer with AWS Location:Plano, TX or Wilmington, DE (Day one onsite) Duration: Contract Job Qualifications / Requirements: Exposure to Cassandra and Oracle DB8-10 years of experience as a DB DeveloperBachelor’s degree requiredGraduate in any technical disciplineMinimum 5+ years of experience in FSD with AWS applications development.DB Developer with special emphasis to database development skills across Migration projectsExposure to Cassandra and Oracle DB8-10 year",https://www.dice.com/jobs?q=developer&location=United%20States&latitude=37.09024&longitude=-95.712891&countryCode=US&locationPrecision=Country&radius=30&radiusUnit=mi&page=1&pageSize=100&filters.postedDate=ONE&filters.employmentType=CONTRACTS&language=en&eid=S2Q_,Posted 19 hours ago,Dice,Contract
"Immediate closeable requirements for IOS/ Android Developer :: Fremont, CA","E-Solutions, Inc.","Fremont, CA, USA","Description for Android Developer Location: Fremont, CA Kotlin, BDD, Android 6+ years of combined software/application development experience Experience with all phases of the development life cycle Experience developing mobile applications using Android, Kotlin. Created 1 or more applications available in Play Store. Familiarity with Agile development including daily scrum and weekly iteration reviews and planning Familiarity with how to optimize code for phones, testing with phones, c",https://www.dice.com/jobs?q=developer&location=United%20States&latitude=37.09024&longitude=-95.712891&countryCode=US&locationPrecision=Country&radius=30&radiusUnit=mi&page=1&pageSize=100&filters.postedDate=ONE&filters.employmentType=CONTRACTS&language=en&eid=S2Q_,Posted 2 hours ago,Dice,Contract
Data Warehouse Developer,RightTalents,"Albany, NY, USA","Title: Lead Data Warehouse Developer Client: State of NY Duration: 60 Months Work Hours: 40 hrs/week Location : Albany, NY SCOPE OF SERVICES Key job responsibilities, by position, are indicated below. The job responsibilities listed below are not intended to be all-inclusive but are representative of common activities the consultants will perform. Mandatory Skills: Maintaining and developing SQL and PL/SQL.Leading and mentoring a team of software developers to maintain and develop SQL and P",https://www.dice.com/jobs?q=developer&location=United%20States&latitude=37.09024&longitude=-95.712891&countryCode=US&locationPrecision=Country&radius=30&radiusUnit=mi&page=1&pageSize=100&filters.postedDate=ONE&filters.employmentType=CONTRACTS&language=en&eid=S2Q_,Posted 4 hours ago,Dice,Contract
