job_title,company_name,address,job_description,job_source_url,job_posted_date,job_source,job_type
Test / Quality Assurance (QA) Engineer / Software Tester –Senior,"CoSolutions, Inc.","Herndon, VA","CoSolutions is seeking aSenior Test / Quality Assurance (QA) Engineer / Software Testerfor an opportunity inHerndon, VA. You will be an integral member of a large enterprise-wide program team supporting a leading intel agency on a contract that provides mission critical, cutting edge and highly technical software / application development, enhancements and O&M support and maintenance tasks for mission critical intelligence systems and applications.
NOTE: This is a 100% on-site position with no ability for remote/virtual work due to the sensitive nature of the work and collaboration of the program team.
Responsibilities:
Interact with program and end-user customers to elicit application requirements and translate their contractual needs, requirements, and technical, schedule and cost constraints into solutions to integrate, test, evaluate, and transition systems into operational enterprise capabilities.
Develop integration, testing, evaluation and transitioning standards, practices, and procedures for customer applications.
Design, develop, and implement test and evaluation strategies, plans and methods to assure reliability of systems in conjunction with system specifications and defined enterprise capabilities to integrate system and enterprise elements together to work as a whole.
Ensure systems and enterprise capabilities comply with requirements and standards through formal verification methods.
Generate system requirements and enterprise capability verification approaches and customer acceptance criteria.
Coordinate system integration, test, evaluation and transition activities with other program/project organizations.
Conduct readiness for system integration, test, evaluation and transition activities.
Compile data and define changes required in testing configurations, procedures, processes, or new testing requirements.
Implement testing processes and ensures all test activities follow those processes.
Produce reports on each test activity and tracks test metrics.
Perform analysis and evaluations of systems under test.
Assesses performance using evaluation criteria and technical performance measures.
Performs analysis of test results and prepares comprehensive system evaluation reports and risk assessments.
Evaluates discrepancy reports and performs integration regression testing to verify/validate incorporated fixes affecting systems and enterprise capabilities.
Minimum Required Qualifications:
Clearance: Active TS/SCI with ability to pass a CI polygraph
Certifications: None
Education: Bachelor's degree in related field of study with 8+ years of relevant experience. Additional experience may be considered in lieu of degree.
Experience:
8+ years Testing / Quality Assurance (QA) / Software/Apps / IT experience.
Experience with all test paths (positive and negative), front-end, back-end, interface, regression and performance testing using multiple browsers and out-of-the-box thinking.
Experience interfacing with end users during In-Plant Acceptance Tests.
Experience working in fast-paced, agile scrum team environment.
Strong documentation and oral/written communication skills.
Strong time management and organizational skills.
Preferred Qualifications:
Experience with test automation tools such as Selenium, Robot Framework, JMeter.
Experience testing complex applications and/or using mathematical algorithms.
Experience as Team Lead.
Current CI poly.
Physical Requirements:
Ability to sit for extended periods of time.
Ability to stand for extended periods of time.
Ability to walk to various locations as needed.
Ability to bend and navigate to perform assigned duties.
About CoSolutions:
Be a part of CoSolutions and join an award winning, experienced and dedicated team of federal contractor professionals specializing in IT, software engineering, cyber IT, intelligence support, customer service and mission critical training. CoSolutions, an SBA-certified Woman-owned Small Business (WOSB), provides mission critical 24/7/365 support to its federal agency customers worldwide and maintains a high-quality staff of cleared and credentialed technical SMEs.
We are proud of our consistent, outstanding Glassdoor reviews from current and former employees! Part of CoSolutions’ culture is to ensure that, while all our employees are working hard to bring their “A” game to work every day, they are also learning a lot, comfortable in their work environment, and enjoying the camaraderie of their teammates.
Our employee benefits are comprehensive, competitive and are a highly touted part of our total compensation package. Benefits include medical, dental, vacation/sick/other paid leave, paid holidays with floating options, vision, Flex Spending Accounts (FSAs), life insurance & AD&D, 401K with employer matching and immediate vesting, access to eLearning, training & education reimbursement, referral bonuses, and additional voluntary benefits such as pet, accident, and cancer insurance as well as LegalShield / IDShield.
CoSolutions is an Equal Opportunity / Affirmative Action Employer. All qualified applicants will receive consideration for employment without regard to gender, race, color, religion, sex, national origin, disability status, protected veteran status, or any other characteristic protected by law.",https://www.monster.com/job-openings/oracle-fusion-middleware-engineer-austin-tx--616648bf-e60d-4b8b-9cda-3d7c3354d353?sid=57f80410-5328-4798-a802-d55853efccad&jvo=m.k.sc.1&so=m.s.sh&hidesmr=1&promoted=KEVEL,Today,Monster,Contract
Software Developer,Minuteman Group LLC,"Lexington, MA","Background/Need
 Our client is seeking eager candidates to develop software-based radio systems to support prototyping, lab experimentation, and field experimentation of novel communications. 
Required Skills:
 • Bachelor’s degree, Master’s degree, or PhD in Computer Science, Computer Engineering, Electrical Engineering, Mathematics, Physics, or related scientific/engineering field
• Experience working with software defined radio hardware platforms (e.g. USRPs, GNURadio, UHD, AIR-T, or others) and developing software in C/C++ and/or Python to prototype communications systems
• Experience working with RF-related laboratory equipment (e.g. RF spectrum analyzers, oscilloscopes, RF power meters, etc…)
• Experience working in the Linux environment including writing command scripts and compiling and installing software packages
• Strong verbal and written communications skills including collaborating with other on-site and/or remote technical team members, preparing and sharing technical results with others, and documenting work to aid other team members and activities
 Helpful skills
 • Working knowledge of signals and systems, digital signal processing, basic communications theory, probability, and linear algebra
• Experience using MATLAB to analyze signals that are generated in simulation or collected experimentally in a laboratory or field setting
• Experience performing research or trade analyses that involve mathematical modeling, formulating and characterizing solutions, and drawing evidence-based conclusions
 -Position requires on site laboratory activities each week - including classified discussions, hardware development, test, debug. Candidate should expect to be onsite 4 days/week with one day remote initially. Candidates expected to be local at the start of the assignment.
-Interview process will be an initial phone screen and then a second round interview with a wider audience; second round preferred onsite
 The position is and is estimated to last Three Years but projects likely to extend for more years

Our Client is famous Government Lab in Massachusetts
 US CITIZENSHIP IS REQUIRED: CURRENT OR PRIOR SECRET CLEARANCE WILL BE A PLUS
 .",https://www.monster.com/job-openings/oracle-fusion-middleware-engineer-austin-tx--616648bf-e60d-4b8b-9cda-3d7c3354d353?sid=57f80410-5328-4798-a802-d55853efccad&jvo=m.k.sc.1&so=m.s.sh&hidesmr=1&promoted=KEVEL,Today,Monster,Contract
Systems Engineer - Senior,Genesis10,"Franklin, WI","Genesis10 is currently seeking a Senior Systems Engineer for a contract lasting through 12/29/23 working with an insurance company in Milwaukee, WI. Local or hybrid candidates only at this time. 
 
Description
To support our growing team, we are seeking an experienced Technical Engineer. This role will provide guidance on DR plan creation, conduct DR testing, drive architecture oversight of various project implementations to technology teams and also perform architectural analysis of the application and their supporting technical services to identify risks and gaps that may enhance their resiliency and recovery capabilities.
 
This position will primarily focus on application and technology analysis and DR testing of technology assets. We believe the ideal candidate will have experience in:  Enterprise Disaster Recovery methodologies and best practices, Modern Technology platforms, architectures, and patterns (Mainframe, WebSphere, Windows, AWS, and hyper-converged infrastructure).
 
Responsibilities
Lead in the development of processes and operating procedures. Research, analyze, develop, and document new processes and procedures to implement new solutions.
Develop structured diagrams for system specification.
Technology resiliency testing (High Availability / Disaster Recovery/ Chaos and Resiliency testing).
Business Process Disaster Recovery testing (partnering with other team members).
Mainframe failover testing (consultative as part of core project team scope: scenario and testing coordination).
Infrastructure Disaster Recovery gap remediation plan creation (Service level).
Qualifications
Knowledge of infrastructure and software environments, programs, methodologies, procedures, and policies. Experience in any area related to IT infrastructure.
Experience in mapping and documenting processes.
Ability to maintain records, and prepare dashboards for reporting, and correspondence related to the work.
Considerable technical problem-solving and analytical skills.
Ability to communicate technical terminology at a level appropriate to the audience.
Preferred Skills
Cyber threat recovery planning and testing experience.
Ranked a Top Staffing Firm in the U.S. by Staffing Industry Analysts for six consecutive years, Genesis10 puts thousands of consultants and employees to work across the United States every year in contract, contract-for-hire, and permanent placement roles. With more than 300 active clients, Genesis10 provides access to many of the Fortune 100 firms and a variety of mid-market organizations across the full spectrum of industry verticals.

Benefits of Working with Genesis10:
Access to hundreds of clients, most who have been working with Genesis10 for 5-20+ years.
The opportunity to have a career-home in Genesis10; many of our consultants have been working exclusively with Genesis10 for years.
Access to an experienced, caring recruiting team (more than 7 years of experience, on average.)
Behavioral Health Platform
Medical, Dental, Vision
Health Savings Account
Voluntary Hospital Indemnity (Critical Illness & Accident)
Voluntary Term Life Insurance
401K
Sick Pay (for applicable states/municipalities)
Commuter Benefits (Dallas, NYC, SF)
Remote opportunities available
For multiple years running, Genesis10 has been recognized as a Top Staffing Firm in the U.S., as a Best Company for Work-Life Balance, as a Best Company for Career Growth, for Diversity, and for Leadership, amongst others. To learn more and to view all our available career opportunities, please visit us at our website.
Genesis10 is an Equal Opportunity Employer. Candidates will receive consideration without regard to their race, color, religion, sex, sexual orientation, gender identity, national origin, disability, or status as a protected veteran.",https://www.monster.com/job-openings/oracle-fusion-middleware-engineer-austin-tx--616648bf-e60d-4b8b-9cda-3d7c3354d353?sid=57f80410-5328-4798-a802-d55853efccad&jvo=m.k.sc.1&so=m.s.sh&hidesmr=1&promoted=KEVEL,Today,Monster,Contract
Full Stack Engineer,Ascendion,"Horsham, PA","About Ascendion
Ascendion is a full-service digital engineering solutions company. We make and manage software platforms and products that power growth and deliver captivating experiences to consumers and employees. Our engineering, cloud, data, experience design, and talent solution capabilities accelerate transformation and impact for enterprise clients. Headquartered in New Jersey, our workforce of 6,000+ Ascenders delivers solutions from around the globe. Ascendion is built differently to engineer the next.
Ascendion | Engineering to elevate life
We have a culture built on opportunity, inclusion, and a spirit of partnership. Come, change the world with us:
•Build the coolest tech for world’s leading brands
•Solve complex problems – and learn new skills
•Experience the power of transforming digital engineering for Fortune 500 clients
•Master your craft with leading training programs and hands-on experience
Experience a community of change makers!
Join a culture of high-performing innovators with endless ideas and a passion for tech. Our culture is the fabric of our company, and it is what makes us unique and diverse. The way we share ideas, learning, experiences, successes, and joy allows everyone to be their best at Ascendion.
About the Role:
Job Title: Full Stack Engineer
Duration: 12+ months contract
Location: Remote

Must Have:
• Experience Typescript, nodejs, Javascript.
• Experience with both angular and react (heavier on react)
• Experience with microdevelopment
• Agile methodology – assisting team in transition from Waterfall
• API Development

Nice to have:
• Healthcare experience
• Jira experience
• AWS/cloud background.
Want to change the world? Let us know.
Tell us about your experiences, education, and ambitions. Bring your knowledge, unique viewpoint, and creativity to the table. Let’s talk!
microdevelopment, micro apps,React,Typescript, nodejs, Javascript,angular",https://www.monster.com/job-openings/oracle-fusion-middleware-engineer-austin-tx--616648bf-e60d-4b8b-9cda-3d7c3354d353?sid=57f80410-5328-4798-a802-d55853efccad&jvo=m.k.sc.1&so=m.s.sh&hidesmr=1&promoted=KEVEL,Today,Monster,Contract
QA Test Engineer,Denysys Corporation,"ARLINGTON, VA","The Denysys Corporation is looking for Secret Cleared Testers to for a position with one of our government clients. This position is currently remote with a requirement to attend meetings on an as needed basis.

• Develop, maintain, and execute manual test cases
• Develop test strategies and test plan documentation
• Work closely with scrum masters, product owners, and developers to resolve and/or retest application functionality
• Support in the setup, configuration, and maintenance of automated testing environments with focus on enablement of continuous testing and DevOps processes
• Translate manual testing scenarios into automated test suites that are robust and easy to maintain

Requirements:
• Experience/training in Salesforce and/or MuleSoft preferred
******Secret Clearance is required****",https://www.monster.com/job-openings/oracle-fusion-middleware-engineer-austin-tx--616648bf-e60d-4b8b-9cda-3d7c3354d353?sid=57f80410-5328-4798-a802-d55853efccad&jvo=m.k.sc.1&so=m.s.sh&hidesmr=1&promoted=KEVEL,Today,Monster,Contract
Web Applications Analyst remote,Mueller Inc,"Ballinger, TX","Overview
Support, test, and maintain Mueller’s web-based applications so that employees and customers can carry out their work with minimal disruptions. This is a remote/work from home job opportunity.  Prefer applicants based in Texas; telecommuting is limited to the states that Mueller is currently located in.
Responsibilities
Partner with the ICT team, contractors, and vendors to resolve employee and customer issues with the website and related applications.
Develop and execute manual and automated testing procedures to ensure that web applications function properly and meet requirements.  Effective testing procedures will include documenting processes and user acceptance criteria.
Administer web applications, including user access, platform management, configuration, and service uptime.
Partner with the ICT team, contractors, and vendors to manage and monitor local and cloud hosted services.
Document software defects in Jira and report defects to developers and managers.
Qualifications
High school diploma or GED required.  Associates degree in Computer Science, Management Information Systems (MIS), or a related field is preferred.
Two (2) years of experience with web content management technologies, such as Liferay DXP, Adobe DXP and WordPress, is preferred.
Two (2) years of experience with web testing using automation tools, such as Selenium, is preferred.
Two (2) years of experience with application testing and quality assurance is preferred.
Ability to provide technical support to system users and to communicate effectively in doing so.
Ability to think conceptually and produce desired results.
A combination of education and experience may be qualifying.
Compensation & Benefits
Hire in salary is $42,500 – $47,500 depending on qualifications.
Generous employer paid benefits valued at $5 to $10 an hour. 
Dual Medical/Rx Plan Options - Base Plan: 100% paid premiums for the employee and children; spouse coverage available for a nominal payroll contribution.
Buy-Up Plan: nominal payroll contribution for the employee, children and spouse
Life Insurance and Accidental Death & Dismemberment Insurance Plan
Long-Term Disability Insurance Plan
401(k) Retirement Plan 
Generous Paid Time Off Benefits
Holidays 
Occupational Illness & Injury 
Employee Assistance Program (EAP)
  Equal Opportunity Employer /Veterans/ Disabled",https://www.monster.com/job-openings/oracle-fusion-middleware-engineer-austin-tx--616648bf-e60d-4b8b-9cda-3d7c3354d353?sid=57f80410-5328-4798-a802-d55853efccad&jvo=m.k.sc.1&so=m.s.sh&hidesmr=1&promoted=KEVEL,Today,Monster,Contract
Dynamics 365 Developer,INSPYR Solutions,"Germantown, MD","Title: Dynamics 365 Developer
Location: Germantown, MD possible remote, but must be on the east coast.
Duration: 6 month possible contract to hire
Compensation: $68 W2 No third party candidates please.
Work Requirements: US Citizen, GC Holders 
 
Qualified candidates may send a copy of their resume (Word Format) to Harold Miller at
hmiller@inspyrsolutions.com
 

Skillset / Experience:
Must have
7 years of experience in software design and development with focus on Microsoft Dynamics CRM
Worked on Customizing and Extending D365 Online/On Premise Customer Engagement Apps (Sales, Customer Service, Marketing).
Worked on Entity customizations (Forms, Views, Fields etc..), Ribbons, Site Maps, Workflows, Plugins, BPFs, Custom Actions, CRM Web APIs.
Worked on Java Script, Web Resources
Experience in configuring security roles
Good understanding on CRM data model / Dataverse
Desired Characteristics
Knowledge of architecture and design patterns
Proven analytical and problem resolution skills
Good debugging skills with knowledge on debug tools, relevant browser plugins etc.
Strong oral and written Communication skills
Aware of methods and practices such as Lean/Agile, etc.
 
Our benefits package includes: 
Comprehensive medical benefits
Competitive pay, 401(k)
Retirement plan
…and much more!
 
About INSPYR Solutions:


As a leading information technology partner, we connect top IT talent with our clients to provide innovative business solutions through our IT Staffing, Professional Services, and Infrastructure Solutions divisions. We understand and value the unique needs of highly-skilled information technology professionals in the industry and always strive to stay above the curve. Our company was founded on the following core values: Be the Best, Understand the Urgency, Never Ever Give Up, Have the Courage to Excel, and Make a Contribution. We take pride in our business model and strive to create a positive workplace environment through an exemplary culture.
 
INSPYR Solutions provides Equal Employment Opportunities (EEO) to all employees and applicants for employment without regard to race, color, religion, sex, national origin, age, disability, or genetics. In addition to federal law requirements, INSPYR complies with applicable state and local laws governing nondiscrimination in employment in every location in which the company has facilities.

 ",https://www.monster.com/job-openings/oracle-fusion-middleware-engineer-austin-tx--616648bf-e60d-4b8b-9cda-3d7c3354d353?sid=57f80410-5328-4798-a802-d55853efccad&jvo=m.k.sc.1&so=m.s.sh&hidesmr=1&promoted=KEVEL,Today,Monster,Contract
IOS Software Development Engineer in Test,Ascendion,"Raleigh, NC","******************100% REMOTE ROLE*********************
Must Have:
•Experience as QA Automation Engineer or Software Development Engineer in Test
•Native mobile experience 
•XCUI Suite (XCode, XCUI Test, swift, IDE) 
•Having experience testing restful based APIs.
Day-2-Day:
•Working on the new healthcare delivery system - health and welfare.
•This candidate will be testing the native mobile application and mobile digital experience for clients.
•The effort is to build out new technology to be able to deliver it to clients.
If interested,share your updated resume at shagun.chourasia@ascendion.com
ios,xcui,apis",https://www.monster.com/job-openings/oracle-fusion-middleware-engineer-austin-tx--616648bf-e60d-4b8b-9cda-3d7c3354d353?sid=57f80410-5328-4798-a802-d55853efccad&jvo=m.k.sc.1&so=m.s.sh&hidesmr=1&promoted=KEVEL,Today,Monster,Contract
Embedded Software Developer (Junior-Mid),Softworld Inc,"Sterling Heights, MI","Embedded Software Developer
70% Onsite 30% Remote
Must be a USC due to the nature of work
Job Description
Looking for an Embedded Linux Software Developer for our Board Support Package or Software Loader / Verifier team. Join a dynamic group of software engineers responsible for the design, development and support of embedded software solutions for the worlds premier land-based combat vehicle producer.

This is a Hybrid role, comprising of 70% in office work and 30% remote.
Responsibilities:
Building and configuring VxWorks, Linux, or other embedded operating systems.
Perform Linux system programming tasks, including driver development and new hardware enablement on embedded Linux systems.
Integrate various software into build systems
Design, develop, test, deploy, maintain and improve software
Enable embedded system security using cryptography and secure architectures
Manage individual priorities, deadlines, deliverables
Requirements:
Degree in Computer Science, Computer, Electrical Engineering (with software development emphasis)
Ability to troubleshoot low level software issues and distinguish between hardware and software issues
Capable of developing C and / or C++ code that can be maintained and updated over decades
Excellent communication skills
Demonstrated problem solving skills, learning capabilities, and multitasking capabilities
Desirable attributes:
Experience with Linux device drivers, bootloaders, or other system programming is a strong plus
Experience with safety critical systems or real time systems is desirable
Experience with one or more build environments such as Buildroot, OpenEmbedded, or in particular Yocto
Experience with Git, DOORs, Jira / Bitbucket / Confluence, gdb, or QT is a plus
Familiarity with security features such as SELinux, verified boot and trusted execution environments is a plus",https://www.monster.com/job-openings/oracle-fusion-middleware-engineer-austin-tx--616648bf-e60d-4b8b-9cda-3d7c3354d353?sid=57f80410-5328-4798-a802-d55853efccad&jvo=m.k.sc.1&so=m.s.sh&hidesmr=1&promoted=KEVEL,Today,Monster,Contract
